{
  "$schema": "../../schema/handoff.schema.json",
  "task": "FEAT-0029",
  "stage": "claimed",
  "by": "implementer",
  "branch": "feat/0029-politica-de-permisos-y-automatismos-del",
  "summary": "Tarea reclamada por agent:implementer. Rama feat/0029-politica-de-permisos-y-automatismos-del. Nada implementado todavía.",
  "next": "planner",
  "at": "2026-08-21T08:44:46Z"
}
