{
  "$schema": "../../schema/handoff.schema.json",
  "task": "FEAT-0043",
  "stage": "claimed",
  "by": "implementer",
  "branch": "feat/0043-realimentacion-sobre-la-calidad-del-refinamiento",
  "summary": "Tarea reclamada por agent:implementer. Rama feat/0043-realimentacion-sobre-la-calidad-del-refinamiento. Nada implementado todavía.",
  "next": "planner",
  "at": "2026-08-21T08:37:58Z"
}
