{
  "$schema": "../../schema/handoff.schema.json",
  "task": "FEAT-0046",
  "stage": "claimed",
  "by": "implementer",
  "branch": "feat/0046-motor-de-proyeccion-con-varios-sumideros",
  "summary": "Tarea reclamada por agent:implementer. Rama feat/0046-motor-de-proyeccion-con-varios-sumideros. Nada implementado todavía.",
  "next": "planner",
  "at": "2026-08-20T16:37:21Z"
}
