{
  "$schema": "../../schema/handoff.schema.json",
  "task": "SPIKE-0005",
  "stage": "claimed",
  "by": "planner",
  "branch": "spike/0005-como-evaluar-si-un-cambio-de",
  "summary": "Tarea reclamada por agent:planner. Rama spike/0005-como-evaluar-si-un-cambio-de. Nada implementado todavía.",
  "next": "planner",
  "at": "2026-08-21T09:03:41Z"
}
