{
  "$schema": "../../schema/handoff.schema.json",
  "task": "FEAT-0042",
  "stage": "claimed",
  "by": "implementer",
  "branch": "feat/0042-frescura-de-documentos-medida-en-commits",
  "summary": "Tarea reclamada por agent:implementer. Rama feat/0042-frescura-de-documentos-medida-en-commits. Nada implementado todavía.",
  "next": "planner",
  "at": "2026-08-21T08:37:12Z"
}
