{
  "$schema": "../../schema/handoff.schema.json",
  "task": "FEAT-0020",
  "stage": "claimed",
  "by": "implementer",
  "branch": "feat/0020-aplicacion-de-la-estructura-y-verificacion",
  "summary": "Tarea reclamada por agent:implementer. Rama feat/0020-aplicacion-de-la-estructura-y-verificacion. Nada implementado todavía.",
  "next": "planner",
  "at": "2026-08-21T08:06:19Z"
}
