{
  "$schema": "../../schema/handoff.schema.json",
  "task": "FEAT-0032",
  "stage": "claimed",
  "by": "implementer",
  "branch": "feat/0032-cerrar-una-tarea-en-una-sola",
  "summary": "Tarea reclamada por agent:implementer. Rama feat/0032-cerrar-una-tarea-en-una-sola. Nada implementado todavía.",
  "next": "planner",
  "at": "2026-08-21T08:26:30Z"
}
