{
  "$schema": "../../schema/handoff.schema.json",
  "task": "FEAT-0048",
  "stage": "claimed",
  "by": "implementer",
  "branch": "feat/0048-sumidero-del-tablero-de-github",
  "summary": "Tarea reclamada por agent:implementer. Rama feat/0048-sumidero-del-tablero-de-github. Nada implementado todavía.",
  "next": "planner",
  "at": "2026-08-20T20:06:43Z"
}
