{
  "$schema": "../../schema/handoff.schema.json",
  "task": "FEAT-0022",
  "stage": "claimed",
  "by": "implementer",
  "branch": "feat/0022-reescritura-de-referencias-tras-mover-ficheros",
  "summary": "Tarea reclamada por agent:implementer. Rama feat/0022-reescritura-de-referencias-tras-mover-ficheros. Nada implementado todavía.",
  "next": "planner",
  "at": "2026-08-20T18:28:52Z"
}
