{
  "$schema": "../../schema/handoff.schema.json",
  "task": "FEAT-0018",
  "stage": "claimed",
  "by": "implementer",
  "branch": "feat/0018-entrevista-iterativa-al-humano",
  "summary": "Tarea reclamada por agent:implementer. Rama feat/0018-entrevista-iterativa-al-humano. Nada implementado todavía.",
  "next": "planner",
  "at": "2026-08-21T07:42:27Z"
}
