{
  "$schema": "../../schema/handoff.schema.json",
  "task": "FEAT-0045",
  "stage": "claimed",
  "by": "implementer",
  "branch": "feat/0045-detectar-ficheros-generados-que-ya-no",
  "summary": "Tarea reclamada por agent:implementer. Rama feat/0045-detectar-ficheros-generados-que-ya-no. Nada implementado todavía.",
  "next": "planner",
  "at": "2026-08-20T17:53:15Z"
}
