{
  "$schema": "../../schema/handoff.schema.json",
  "task": "FEAT-0019",
  "stage": "claimed",
  "by": "implementer",
  "branch": "feat/0019-inferencia-y-propuesta-de-adopcion",
  "summary": "Tarea reclamada por agent:implementer. Rama feat/0019-inferencia-y-propuesta-de-adopcion. Nada implementado todavía.",
  "next": "planner",
  "at": "2026-08-21T08:01:36Z"
}
